{
  "schemaVersion": 2,
  "apiVersion": "^1.0.0",
  "id": "acme.indexer",
  "name": "Indexer",
  "version": "1.0.0",
  "publisher": "acme",
  "permissions": {
    "system": [
      "fs"
    ]
  },
  "marketplace": {
    "description": "A single-segment event name, which the backend supervisor accepts.",
    "license": "MIT"
  },
  "contributes": {
    "views": [
      {
        "id": "left",
        "kind": "custom",
        "location": "left",
        "title": "Files",
        "entry": "frontend/left/index.html"
      }
    ]
  },
  "backend": {
    "entry": "backend/acme-indexer",
    "protocolVersion": 1,
    "activation": "startup",
    "methods": [
      "files.search",
      "files.index"
    ],
    "events": [
      "progress"
    ]
  }
}
